codigo_fuente,nombre_fuente,institucion,tipo_fuente,periodo,nivel_territorial,url,estado_revision,fecha_consulta,decision_estudiante,observaciones
F01,Plan Metropolitano de Seguridad y Convivencia Ciudadana 2023-2027,Municipio del Distrito Metropolitano de Quito,Plan de política pública,2023-2027,Distrito Metropolitano de Quito,https://seguridad.quito.gob.ec/wp-content/uploads/2024/12/Plan-Metropolitano-de-Seguridad-Ciudadana-Version-Web.pdf,Texto extraído; estructura documental en revisión; verificación sustantiva pendiente,2026-07-21,Aceptada para revisión documental,PDF procesado con pypdf: 176 páginas totales, 163 con texto extraíble y 13 sin texto. Toda cifra o cita deberá contrastarse con el PDF original
F02,Seguimiento al Plan Metropolitano de Seguridad y Convivencia Ciudadana 2023-2027,Observatorio Metropolitano de Seguridad Ciudadana,Portal de seguimiento,2023 en adelante,Distrito Metropolitano de Quito,https://observatorioseguridad.quito.gob.ec/seguimiento-al-plan-metropolitano-de-seguridad-y-convivencia-ciudadana-2023-2027/,Texto preparado y revisión sustantiva preliminar realizada; contraste final pendiente,2026-07-21,Pendiente de verificación adicional,Nivel DMQ; periodo 2023-2027; utilidad seguimiento institucional; limitación contenido visible mayormente de navegación
F03,Resolución ADMQ 008-2024,Municipio del Distrito Metropolitano de Quito,Norma y resolución de implementación,2024,Distrito Metropolitano de Quito,https://www7.quito.gob.ec/mdmq_ordenanzas/Administraci%C3%B3n%202023-2027/Resoluciones%20de%20Alcald%C3%ADa/2024/RADMQ-008-2024%20-%20Implementaci%C3%B3n%20del%20Plan%20Metropolitano%20de%20Seguridad%20y%20Convivencia%20Ciudadana%202023-2027.pdf,Texto preparado y revisión sustantiva preliminar realizada; contraste final pendiente,2026-07-21,Aceptada como evidencia principal,Nivel DMQ; periodo 2024 y referencia 2023-2027; utilidad marco normativo; limitación no demuestra ejecución automática
F04,Justicia y crimen,Instituto Nacional de Estadística y Censos,Portal estadístico,Varía según indicador,Nacional con posible desagregación territorial,https://www.ecuadorencifras.gob.ec/justicia-y-crimen/,Texto preparado; pertinencia limitada; contraste final pendiente,2026-07-21,Aceptada como evidencia complementaria,Nivel nacional; periodo no determinado en texto preparado; utilidad contextual y de referencia; limitación sin desagregación confirmada para DMQ
F05,Encuesta de Victimización y Percepción de Inseguridad 2011,Instituto Nacional de Estadística y Censos,Encuesta y base estadística,2011,Nacional con posible desagregación territorial,https://anda.inec.gob.ec/anda5/index.php/catalog/673,Texto preparado; uso únicamente histórico o metodológico,2026-07-21,Aceptada únicamente como antecedente histórico o metodológico,Nivel nacional y provincial urbano; periodo 2011; utilidad metodológica y de contexto; limitación desactualización para análisis actual
F06,Estadísticas de emergencias coordinadas en 2024,Servicio Integrado de Seguridad ECU 911,Informe y estadística institucional,2024,Distrito Metropolitano de Quito,https://www.ecu911.gob.ec/el-ecu-911-coordino-la-atencion-de-mas-de-3-millones-de-emergencias-en-2024/,Texto preparado y revisión sustantiva preliminar realizada; contraste final pendiente,2026-07-21,Aceptada como evidencia complementaria,Nivel nacional con dato de Quito; periodo 2024; utilidad operativa en coordinación y cobertura; limitación emergencias no equivalen a delitos
